{
  "code": "VV-BASIS-10",
  "name": "Identität & Authentifizierung",
  "kind": "basis",
  "version": "0.1",
  "status": "skeleton",
  "gate": 0,
  "adr": [
    "ADR-03"
  ],
  "dossier": "docs/bausteine/VV-BASIS-10.md",
  "tables": [],
  "gates": [
    {
      "id": 0,
      "title": "Stage 0 — Fundament-Gerüst",
      "evidence": [
        "evidence/stage-0/gate0-checklist.md",
        "docs/bausteine/VV-BASIS-10.md"
      ]
    }
  ],
  "register_refs": [
    "B10-1",
    "B10-2"
  ],
  "module": null
}
